{
  "schemaVersion": 1,
  "program": "agentic-security-engineering-excellence",
  "createdAt": "2026-10-16T12:20:50.208Z",
  "updatedAt": "2026-10-16T13:55:00.414Z",
  "revision": 204,
  "checkout": {
    "commit": "d911079e77f629324970eeeaa512694e2cef9ad6",
    "branch": "feature/engineering-excellence",
    "dirty": true,
    "capturedAt": "2026-10-16T13:55:00.413Z"
  },
  "tasks": {
    "E0-01": {
      "state": "done",
      "attempts": 1,
      "startedAt": "2026-10-16T12:26:29.312Z",
      "completedAt": "2026-10-16T12:37:31.079Z",
      "heartbeatAt": "2026-10-16T12:37:30.819Z",
      "activeProcess": null,
      "exitCode": 0,
      "commit": "ee16dbb90f48968114b7424ff0f7e961072e79a1",
      "blocker": null,
      "failure": null,
      "commands": [
        {
          "id": "c-6defdfd1",
          "argv": [
            "node",
            "scripts/engineering-excellence/inventory.mjs",
            "--verify",
            "--timeout-ms",
            "600000"
          ],
          "cwd": "/Users/ross/code/agentic-security-ee",
          "kind": "other",
          "startedAt": "2026-10-16T12:29:35.274Z",
          "endedAt": "2026-10-16T12:29:47.033Z",
          "timeoutMs": 3600000,
          "outcome": "signaled",
          "exitCode": null,
          "signal": "SIGTERM",
          "durationMs": 11748,
          "log": "scripts/engineering-excellence/logs/E0-01/2026-10-16T12-29-35-275Z-c-6defdfd1.log",
          "logSha256": "e3b0c44298fc1c149afbf4c8996fb92427ae41e4649b934ca495991b7852b855",
          "attempt": 1,
          "envKeys": [
            "AI_AGENT",
            "CLAUDECODE",
            "CLAUDE_CODE_CHILD_SESSION",
            "CLAUDE_CODE_ENTRYPOINT",
            "CLAUDE_CODE_EXECPATH",
            "CLAUDE_CODE_MESSAGING_SOCKET",
            "CLAUDE_CODE_SESSION_ATTENDED",
            "CLAUDE_CODE_SESSION_ID",
            "CLAUDE_EFFORT",
            "CLAUDE_PID",
            "COLORTERM",
            "CONDA_DEFAULT_ENV",
            "CONDA_EXE",
            "CONDA_PREFIX",
            "CONDA_PROMPT_MODIFIER",
            "CONDA_PYTHON_EXE",
            "CONDA_SHLVL",
            "COREPACK_ENABLE_AUTO_PIN",
            "FPATH",
            "GIT_EDITOR",
            "GSETTINGS_SCHEMA_DIR",
            "GSETTINGS_SCHEMA_DIR_CONDA_BACKUP",
            "HOME",
            "HOMEBREW_CELLAR",
            "HOMEBREW_PREFIX",
            "HOMEBREW_REPOSITORY",
            "INFOPATH",
            "LANG",
            "LOGNAME",
            "NVM_BIN",
            "NVM_CD_FLAGS",
            "NVM_DIR",
            "NVM_INC",
            "NoDefaultCurrentDirectoryInExePath",
            "OLDPWD",
            "OSLogRateLimit",
            "PATH",
            "PWD",
            "SHELL",
            "SHLVL",
            "SSH_AUTH_SOCK",
            "TERM",
            "TERM_PROGRAM",
            "TERM_PROGRAM_VERSION",
            "TERM_SESSION_ID",
            "TMPDIR",
            "USER",
            "XPC_FLAGS",
            "XPC_SERVICE_NAME",
            "_",
            "_CE_CONDA",
            "_CE_M",
            "_CONDA_EXE",
            "_CONDA_ROOT",
            "__CFBundleIdentifier",
            "__CF_USER_TEXT_ENCODING"
          ]
        },
        {
          "id": "c-f93cf032",
          "argv": [
            "node",
            "scripts/engineering-excellence/inventory.mjs",
            "--verify",
            "--timeout-ms",
            "600000"
          ],
          "cwd": "/Users/ross/code/agentic-security-ee",
          "kind": "other",
          "startedAt": "2026-10-16T12:33:50.000Z",
          "endedAt": "2026-10-16T12:37:03.306Z",
          "timeoutMs": 3600000,
          "outcome": "exited",
          "exitCode": 1,
          "signal": null,
          "durationMs": 193294,
          "log": "scripts/engineering-excellence/logs/E0-01/2026-10-16T12-33-50-000Z-c-f93cf032.log",
          "logSha256": "b91536bbbf2965afb8b3582ee404fbcbf2dea23673c154babafdcc3600df5881",
          "attempt": 1,
          "envKeys": [
            "AI_AGENT",
            "CLAUDECODE",
            "CLAUDE_CODE_CHILD_SESSION",
            "CLAUDE_CODE_ENTRYPOINT",
            "CLAUDE_CODE_EXECPATH",
            "CLAUDE_CODE_MESSAGING_SOCKET",
            "CLAUDE_CODE_SESSION_ATTENDED",
            "CLAUDE_CODE_SESSION_ID",
            "CLAUDE_EFFORT",
            "CLAUDE_PID",
            "COLORTERM",
            "CONDA_DEFAULT_ENV",
            "CONDA_EXE",
            "CONDA_PREFIX",
            "CONDA_PROMPT_MODIFIER",
            "CONDA_PYTHON_EXE",
            "CONDA_SHLVL",
            "COREPACK_ENABLE_AUTO_PIN",
            "FPATH",
            "GIT_EDITOR",
            "GSETTINGS_SCHEMA_DIR",
            "GSETTINGS_SCHEMA_DIR_CONDA_BACKUP",
            "HOME",
            "HOMEBREW_CELLAR",
            "HOMEBREW_PREFIX",
            "HOMEBREW_REPOSITORY",
            "INFOPATH",
            "LANG",
            "LOGNAME",
            "NVM_BIN",
            "NVM_CD_FLAGS",
            "NVM_DIR",
            "NVM_INC",
            "NoDefaultCurrentDirectoryInExePath",
            "OLDPWD",
            "OSLogRateLimit",
            "PATH",
            "PWD",
            "SHELL",
            "SHLVL",
            "SSH_AUTH_SOCK",
            "TERM",
            "TERM_PROGRAM",
            "TERM_PROGRAM_VERSION",
            "TERM_SESSION_ID",
            "TMPDIR",
            "USER",
            "XPC_FLAGS",
            "XPC_SERVICE_NAME",
            "_",
            "_CE_CONDA",
            "_CE_M",
            "_CONDA_EXE",
            "_CONDA_ROOT",
            "__CFBundleIdentifier",
            "__CF_USER_TEXT_ENCODING"
          ]
        },
        {
          "id": "c-cd9e21c6",
          "argv": [
            "node",
            "scripts/engineering-excellence/inventory.mjs",
            "--verify",
            "--only",
            "language-support"
          ],
          "cwd": "/Users/ross/code/agentic-security-ee",
          "kind": "other",
          "startedAt": "2026-10-16T12:37:18.884Z",
          "endedAt": "2026-10-16T12:37:19.528Z",
          "timeoutMs": 600000,
          "outcome": "exited",
          "exitCode": 0,
          "signal": null,
          "durationMs": 632,
          "log": "scripts/engineering-excellence/logs/E0-01/2026-10-16T12-37-18-884Z-c-cd9e21c6.log",
          "logSha256": "a28f514722b2bbc2ef7d959cd12c32807a7b2df2e923a1a2c9cf11aad48dd07e",
          "attempt": 1,
          "envKeys": [
            "AI_AGENT",
            "CLAUDECODE",
            "CLAUDE_CODE_CHILD_SESSION",
            "CLAUDE_CODE_ENTRYPOINT",
            "CLAUDE_CODE_EXECPATH",
            "CLAUDE_CODE_MESSAGING_SOCKET",
            "CLAUDE_CODE_SESSION_ATTENDED",
            "CLAUDE_CODE_SESSION_ID",
            "CLAUDE_EFFORT",
            "CLAUDE_PID",
            "COLORTERM",
            "CONDA_DEFAULT_ENV",
            "CONDA_EXE",
            "CONDA_PREFIX",
            "CONDA_PROMPT_MODIFIER",
            "CONDA_PYTHON_EXE",
            "CONDA_SHLVL",
            "COREPACK_ENABLE_AUTO_PIN",
            "FPATH",
            "GIT_EDITOR",
            "GSETTINGS_SCHEMA_DIR",
            "GSETTINGS_SCHEMA_DIR_CONDA_BACKUP",
            "HOME",
            "HOMEBREW_CELLAR",
            "HOMEBREW_PREFIX",
            "HOMEBREW_REPOSITORY",
            "INFOPATH",
            "LANG",
            "LOGNAME",
            "NVM_BIN",
            "NVM_CD_FLAGS",
            "NVM_DIR",
            "NVM_INC",
            "NoDefaultCurrentDirectoryInExePath",
            "OLDPWD",
            "OSLogRateLimit",
            "PATH",
            "PWD",
            "SHELL",
            "SHLVL",
            "SSH_AUTH_SOCK",
            "TERM",
            "TERM_PROGRAM",
            "TERM_PROGRAM_VERSION",
            "TERM_SESSION_ID",
            "TMPDIR",
            "USER",
            "XPC_FLAGS",
            "XPC_SERVICE_NAME",
            "_",
            "_CE_CONDA",
            "_CE_M",
            "_CONDA_EXE",
            "_CONDA_ROOT",
            "__CFBundleIdentifier",
            "__CF_USER_TEXT_ENCODING"
          ]
        },
        {
          "id": "c-80b73f4a",
          "argv": [
            "node",
            "--test",
            "test/engineering-excellence/e0-01-inventory.test.js"
          ],
          "cwd": "/Users/ross/code/agentic-security-ee/scanner",
          "kind": "test",
          "startedAt": "2026-10-16T12:37:29.470Z",
          "endedAt": "2026-10-16T12:37:30.817Z",
          "timeoutMs": 300000,
          "outcome": "exited",
          "exitCode": 0,
          "signal": null,
          "durationMs": 1336,
          "log": "scripts/engineering-excellence/logs/E0-01/2026-10-16T12-37-29-471Z-c-80b73f4a.log",
          "logSha256": "de103ea66ddbb0dc66183af695c166827ed6e1350446242ff16be868d498037e",
          "attempt": 1,
          "envKeys": [
            "AI_AGENT",
            "CLAUDECODE",
            "CLAUDE_CODE_CHILD_SESSION",
            "CLAUDE_CODE_ENTRYPOINT",
            "CLAUDE_CODE_EXECPATH",
            "CLAUDE_CODE_MESSAGING_SOCKET",
            "CLAUDE_CODE_SESSION_ATTENDED",
            "CLAUDE_CODE_SESSION_ID",
            "CLAUDE_EFFORT",
            "CLAUDE_PID",
            "COLORTERM",
            "CONDA_DEFAULT_ENV",
            "CONDA_EXE",
            "CONDA_PREFIX",
            "CONDA_PROMPT_MODIFIER",
            "CONDA_PYTHON_EXE",
            "CONDA_SHLVL",
            "COREPACK_ENABLE_AUTO_PIN",
            "FPATH",
            "GIT_EDITOR",
            "GSETTINGS_SCHEMA_DIR",
            "GSETTINGS_SCHEMA_DIR_CONDA_BACKUP",
            "HOME",
            "HOMEBREW_CELLAR",
            "HOMEBREW_PREFIX",
            "HOMEBREW_REPOSITORY",
            "INFOPATH",
            "LANG",
            "LOGNAME",
            "NVM_BIN",
            "NVM_CD_FLAGS",
            "NVM_DIR",
            "NVM_INC",
            "NoDefaultCurrentDirectoryInExePath",
            "OLDPWD",
            "OSLogRateLimit",
            "PATH",